{
  "$schema": "https://json-schema.org/draft/2020-12/schema",
  "$id": "room.schema.json",
  "title": "Room (data/rooms/<id>.json)",
  "description": "One room. Rules JSON Schema cannot express (width + depth <= 32, bounds, overlaps, known types) are checked by src/data/validate.js.",
  "type": "object",
  "required": ["schemaVersion", "id", "name", "biome", "size", "spawn"],
  "additionalProperties": false,
  "properties": {
    "$schema": { "type": "string" },
    "schemaVersion": { "$ref": "common.schema.json#/$defs/schemaVersion" },
    "id": {
      "$ref": "common.schema.json#/$defs/id",
      "description": "Must match the file name."
    },
    "name": { "type": "string", "minLength": 1, "description": "Shown when entering the room." },
    "authored": {
      "type": "boolean",
      "description": "A real game room made by the author (D90): development steps never change it or attach new rooms to it. Omitted for test rooms."
    },
    "biome": { "$ref": "common.schema.json#/$defs/id", "description": "Id from biomes.json." },
    "size": {
      "description": "[width x, height y, depth z] in blocks; width + depth <= 32.",
      "type": "array",
      "prefixItems": [
        { "type": "integer", "minimum": 1, "maximum": 31 },
        { "type": "integer", "minimum": 2, "maximum": 6 },
        { "type": "integer", "minimum": 1, "maximum": 31 }
      ],
      "items": false,
      "minItems": 3
    },
    "spawn": {
      "$ref": "common.schema.json#/$defs/point",
      "description": "Player start (feet center) when the game starts in this room."
    },
    "reset": {
      "$ref": "common.schema.json#/$defs/point",
      "description": "Where the wizard reappears (feet center) after dying in this room, however he entered it. Defaults to \"spawn\" if omitted. Above the floor is fine: he falls from there like anywhere else."
    },
    "timer": {
      "type": "integer",
      "minimum": 3,
      "maximum": 600,
      "description": "Seconds on the room's watchdog timer (D172): it starts once the room has faded in and runs while the wizard is in the room (menus hold it); at zero he dies and the room resets. Omitted: no timer."
    },
    "exits": {
      "type": "array",
      "items": { "$ref": "#/$defs/exit" }
    },
    "blocks": {
      "description": "Anonymous static blocks: plain (room color), hazard (hurts on touch) or void (kills on landing).",
      "type": "array",
      "items": { "$ref": "#/$defs/block" }
    },
    "holes": {
      "description": "Floor tiles that are pits: deadly for the player; a pushed block drops in and fills the hole.",
      "type": "array",
      "items": { "$ref": "#/$defs/hole" }
    },
    "shrine": {
      "$ref": "common.schema.json#/$defs/tile",
      "description": "Backup shrine floor tile (D97): stepping on it refills integrity, energy and backups; with no backups left the wizard reboots on the nearest one (world map distance)."
    },
    "objects": {
      "description": "Typed objects with stable ids (types from defs.json).",
      "type": "array",
      "items": { "$ref": "#/$defs/object" }
    },
    "enemies": {
      "description": "Enemies with stable ids (templates from defs.json \"enemies\"); ids are shared with objects.",
      "type": "array",
      "items": { "$ref": "#/$defs/enemy" }
    },
    "pickups": {
      "description": "Pickups with stable ids (types from defs.json \"pickups\"), hovering in their cell; ids are shared with objects and enemies.",
      "type": "array",
      "items": { "$ref": "#/$defs/pickup" }
    }
  },
  "$defs": {
    "exit": {
      "description": "Opening in one side of the room. It leads to the room in the next world map cell in its direction (D259), into that room's exit in the opposite side; several exits in one side pair up in order along it (by at, then y).",
      "type": "object",
      "required": ["id", "side", "at"],
      "additionalProperties": false,
      "properties": {
        "id": { "$ref": "common.schema.json#/$defs/id" },
        "side": { "enum": ["-x", "+x", "-z", "+z"] },
        "at": {
          "type": "integer",
          "minimum": 0,
          "description": "First cell along the side (z for x sides, x for z sides)."
        },
        "width": { "type": "integer", "minimum": 1, "default": 2 },
        "y": { "type": "integer", "minimum": 0, "default": 0, "description": "Floor level of the opening." },
        "height": { "type": "integer", "minimum": 2, "default": 2 },
        "requires": {
          "description": "What opens the exit (D75, D101, D140, D151): it is solid until every entry holds; it closes again when a switch goes off, but not while the wizard stands in it, and it is always open for him when he came in through it (D69). Entries: {\"switch\": id} (a target or plate of this room; one entry per switch), {\"switch\": \"*\"} (every switch in the room; the room needs at least one) and {\"access\": level} (his access level at least this, raised at the core).",
          "type": "array",
          "minItems": 1,
          "uniqueItems": true,
          "items": {
            "oneOf": [
              {
                "type": "object",
                "required": ["switch"],
                "additionalProperties": false,
                "properties": {
                  "switch": { "oneOf": [{ "const": "*" }, { "$ref": "common.schema.json#/$defs/id" }] }
                }
              },
              {
                "type": "object",
                "required": ["access"],
                "additionalProperties": false,
                "properties": {
                  "access": { "type": "integer", "minimum": 1, "maximum": 15 }
                }
              }
            ]
          }
        },
        "oneWay": {
          "type": "boolean",
          "default": false,
          "description": "A way in only (D259): the wizard arrives through it, but it is shut from this side, a plain barrier that never opens (no requires or hidden; the exit it pairs with must not be one-way). The reachability checker makes sure he can leave the room another way."
        },
        "hidden": {
          "type": "boolean",
          "default": false,
          "description": "Solid wall, drawn as one, until a scan reaches it (D128); then it opens and shows (with \"locked\" or \"access\" it is a lock from then on). Revealed until the room resets; always open for the wizard when he came in through it."
        }
      }
    },
    "block": {
      "type": "object",
      "required": ["at"],
      "additionalProperties": false,
      "properties": {
        "type": {
          "$ref": "common.schema.json#/$defs/id",
          "default": "block",
          "description": "A block type in defs.json \"blocks\" (D60): e.g. block (plain), hazard (hurts on touch), void (kills when landed on), collapsing (gives way under the wizard), gate and bridge (switched, D140)."
        },
        "at": { "$ref": "common.schema.json#/$defs/cell" },
        "to": {
          "$ref": "common.schema.json#/$defs/cell",
          "description": "Optional opposite corner; fills the box from at to to (inclusive)."
        },
        "switches": {
          "$ref": "#/$defs/switches",
          "description": "Switch gates only (D140, D141): the ids of the switches that power every cell of it; without, every switch in the room. A gate is gone (a bridge there) while they are all on."
        }
      }
    },
    "hole": {
      "type": "object",
      "required": ["at"],
      "additionalProperties": false,
      "properties": {
        "at": { "$ref": "common.schema.json#/$defs/tile" },
        "to": {
          "$ref": "common.schema.json#/$defs/tile",
          "description": "Optional opposite corner; fills the rectangle from at to to (inclusive)."
        }
      }
    },
    "object": {
      "type": "object",
      "required": ["id", "type", "at"],
      "additionalProperties": false,
      "properties": {
        "id": { "$ref": "common.schema.json#/$defs/id" },
        "type": { "$ref": "common.schema.json#/$defs/id", "description": "Object type from defs.json." },
        "at": { "$ref": "common.schema.json#/$defs/cell" },
        "overrides": {
          "type": "object",
          "description": "Values that replace the type defaults for this object only. A decoration (D117) also takes \"face\": \"+z\" (the default) or \"+x\", the side it faces."
        },
        "path": {
          "$ref": "#/$defs/path",
          "description": "Required for platforms (and only allowed on them): the path they follow, starting at \"at\"."
        },
        "text": {
          "$ref": "common.schema.json#/$defs/id",
          "description": "Screens only (D118): the id of a text in data/lore.json, shown in the wizard's terminal when he comes near."
        },
        "switches": {
          "$ref": "#/$defs/switches",
          "description": "Platforms only (D140): the ids of the switches that run it; it runs only while they are all on and stops where it is when one goes off (without, it always runs)."
        }
      }
    },
    "switches": {
      "description": "Ids of switches (targets and plates) in the room (D140).",
      "type": "array",
      "minItems": 1,
      "uniqueItems": true,
      "items": { "$ref": "common.schema.json#/$defs/id" }
    },
    "pickup": {
      "type": "object",
      "required": ["id", "type", "at"],
      "additionalProperties": false,
      "properties": {
        "id": { "$ref": "common.schema.json#/$defs/id" },
        "type": { "$ref": "common.schema.json#/$defs/id", "description": "Pickup type from defs.json." },
        "at": { "$ref": "common.schema.json#/$defs/cell", "description": "Cell it hovers in; the wizard takes it by touching that cell's middle." }
      }
    },
    "enemy": {
      "type": "object",
      "required": ["id", "template", "at"],
      "additionalProperties": false,
      "properties": {
        "id": { "$ref": "common.schema.json#/$defs/id" },
        "template": { "$ref": "common.schema.json#/$defs/id", "description": "Enemy template from defs.json \"enemies\" (D79): everything about it (D119); the room gives only its cell and path." },
        "at": { "$ref": "common.schema.json#/$defs/cell", "description": "Spawn cell (its lower corner); it starts here whenever the room resets." },
        "path": {
          "$ref": "#/$defs/path",
          "description": "Patrol path: level (legs along x or z at the height of \"at\"); only x and z count once it walks, so it keeps to it after falling off a ledge. No \"speed\": it walks at its template's (D119). Without a path it stays put."
        },
        "drop": {
          "$ref": "common.schema.json#/$defs/id",
          "description": "Bosses only, and every boss has one (D104, D135): the id of a pickup of this room, a permanent one (no refill), that it holds until it is beaten; then the pickup shows in its cell. While its save bit is found, the boss is left out of the room."
        }
      }
    },
    "path": {
      "description": "Path shared by moving platforms and patrolling enemies: from the object's \"at\" through \"points\", each leg along one axis.",
      "type": "object",
      "required": ["points"],
      "additionalProperties": false,
      "properties": {
        "points": {
          "description": "Waypoints after \"at\" (the object's lower corner); each differs from the one before on exactly one axis.",
          "type": "array",
          "minItems": 1,
          "items": { "$ref": "common.schema.json#/$defs/cell" }
        },
        "mode": {
          "enum": ["pingpong", "loop"],
          "default": "pingpong",
          "description": "pingpong: there and back; loop: from the last point straight back to \"at\" (also along one axis)."
        },
        "speed": {
          "type": "number",
          "exclusiveMinimum": 0,
          "maximum": 8,
          "default": 2,
          "description": "Units per second; platforms only (an enemy walks at its template's speed, D119)."
        },
        "pause": {
          "type": "number",
          "minimum": 0,
          "maximum": 10,
          "default": 0,
          "description": "Seconds of waiting at the ends: both ends of a ping-pong path, \"at\" on a loop."
        }
      }
    }
  }
}
