{
  "$schema": "../../schemas/room.schema.json",
  "schemaVersion": 1,
  "id": "atrium",
  "name": "Atrium",
  "biome": "home_lattice",
  "size": [12, 4, 12],
  "spawn": [1.5, 0, 6.5],
  "exits": [
    { "id": "west", "side": "-x", "at": 5 },
    { "id": "north", "side": "-z", "at": 4 },
    { "id": "south", "side": "+z", "at": 4 }
  ],
  "blocks": [
    { "at": [8, 0, 0], "to": [11, 0, 2] },
    { "type": "stair_x", "at": [7, 0, 1] },
    { "type": "bridge", "at": [10, 0, 7], "to": [10, 0, 9] }
  ],
  "holes": [
    { "at": [10, 3] },
    { "at": [11, 4] },
    { "at": [7, 7], "to": [9, 11] },
    { "at": [10, 7], "to": [11, 9] }
  ],
  "shrine": [1, 10],
  "objects": [
    { "id": "screen_1", "type": "screen", "at": [0, 0, 3], "text": "tut_plates", "overrides": { "face": "+x" } },
    { "id": "crate_ledge", "type": "crate", "at": [11, 1, 1] },
    { "id": "plate_1", "type": "plate", "at": [11, 0, 3] }
  ],
  "pickups": [{ "id": "boost_rainbow_1", "type": "boost_rainbow", "at": [11, 0, 11] }]
}
