{
  "$schema": "../../schemas/room.schema.json",
  "schemaVersion": 1,
  "id": "warden_pit",
  "name": "Warden Pit",
  "biome": "home_lattice",
  "size": [14, 6, 14],
  "spawn": [6.5, 0, 1.5],
  "exits": [
    { "id": "north", "side": "-z", "at": 6 },
    { "id": "south", "side": "+z", "at": 6 },
    { "id": "west", "side": "-x", "at": 2, "width": 1, "y": 4 }
  ],
  "blocks": [
    { "at": [6, 0, 4], "to": [7, 1, 4] },
    { "at": [6, 0, 9], "to": [7, 1, 9] },
    { "at": [10, 0, 3], "to": [10, 1, 4] },
    { "at": [3, 0, 9], "to": [3, 1, 10] },
    { "at": [10, 0, 9], "to": [10, 1, 10] },
    { "at": [0, 0, 2], "to": [1, 3, 2] },
    { "at": [3, 0, 6], "to": [3, 1, 7] },
    { "at": [1, 0, 3], "to": [1, 0, 9] },
    { "at": [0, 0, 9] },
    { "at": [2, 0, 8], "to": [2, 0, 10] },
    { "at": [3, 0, 8] }
  ],
  "objects": [
    { "id": "pillar_west", "type": "data_pillar", "at": [0, 0, 12], "overrides": { "face": "+x" } },
    { "id": "pillar_east", "type": "data_pillar", "at": [13, 0, 0], "overrides": { "face": "+z" } },
    { "id": "crate_step", "type": "crate", "at": [1, 1, 9] }
  ],
  "enemies": [{ "id": "null_pointer", "template": "null_pointer", "at": [6, 0, 6], "drop": "fragment_7" }],
  "pickups": [
    { "id": "fragment_7", "type": "fragment_7", "at": [7, 0, 7] },
    { "id": "refill_energy_west", "type": "refill_energy", "at": [0, 0, 13] },
    { "id": "refill_energy_east", "type": "refill_energy", "at": [13, 0, 13] },
    { "id": "refill_integrity_pit", "type": "refill_integrity", "at": [0, 0, 7] }
  ]
}
