{
  "$schema": "../../schemas/room.schema.json",
  "schemaVersion": 1,
  "id": "bolt_gallery",
  "name": "Bolt Gallery",
  "biome": "home_lattice",
  "size": [12, 4, 12],
  "spawn": [4.5, 0, 10.5],
  "exits": [
    { "id": "south", "side": "+z", "at": 4 },
    { "id": "north", "side": "-z", "at": 9, "requires": [{ "switch": "target_1" }] }
  ],
  "blocks": [
    { "type": "fence", "at": [2, 0, 0], "to": [2, 2, 1] },
    { "type": "gate", "at": [2, 0, 2], "to": [2, 2, 2], "switches": ["target_2"] },
    { "at": [0, 0, 3], "to": [2, 2, 3] },
    { "at": [0, 0, 4], "to": [2, 1, 4] },
    { "type": "gate", "at": [8, 0, 8], "to": [10, 0, 8], "switches": ["target_2"] },
    { "type": "gate", "at": [8, 0, 9], "to": [8, 0, 10], "switches": ["target_2"] },
    { "type": "gate", "at": [10, 0, 9], "to": [10, 0, 10], "switches": ["target_2"] },
    { "type": "gate", "at": [9, 0, 10], "switches": ["target_2"] },
    { "at": [1, 0, 8], "to": [2, 1, 8] },
    { "at": [3, 0, 8] },
    { "type": "stair_nx", "at": [3, 1, 8] },
    { "at": [4, 0, 8] },
    { "type": "stair_nz", "at": [4, 0, 9] }
  ],
  "holes": [{ "at": [0, 5], "to": [11, 6] }],
  "objects": [
    { "id": "crate_e", "type": "crate", "at": [11, 0, 2] },
    { "id": "crate_1", "type": "crate", "at": [9, 0, 9] },
    { "id": "crate_2", "type": "crate", "at": [10, 0, 3] },
    { "id": "target_2", "type": "target", "at": [1, 2, 4] },
    { "id": "target_1", "type": "target", "at": [2, 2, 4] },
    { "id": "crate_3", "type": "crate", "at": [5, 0, 9] }
  ],
  "enemies": [
    { "id": "tower_bridge", "template": "cron", "at": [5, 0, 3] },
    { "id": "cron_1", "template": "cron", "at": [8, 0, 4] },
    { "id": "cron_2", "template": "cron", "at": [6, 0, 1] }
  ],
  "pickups": [{ "id": "fragment_3", "type": "fragment_3", "at": [1, 0, 0] }]
}
