{
  "$schema": "../../schemas/room.schema.json",
  "schemaVersion": 1,
  "id": "stack_yard",
  "name": "Stack Yard",
  "biome": "glitchmire",
  "size": [8, 4, 8],
  "spawn": [1.5, 1, 3.5],
  "exits": [
    { "id": "west", "side": "-x", "at": 3, "y": 1 },
    { "id": "east", "side": "+x", "at": 5 }
  ],
  "blocks": [
    { "at": [0, 0, 2], "to": [1, 0, 5] },
    { "at": [6, 0, 0], "to": [7, 1, 1] }
  ],
  "objects": [
    { "id": "crate_a", "type": "crate", "at": [4, 0, 4] },
    { "id": "crate_b", "type": "crate", "at": [4, 1, 4] },
    { "id": "crate_c", "type": "crate_cross", "at": [3, 0, 6] }
  ]
}
