{
  "$schema": "../../schemas/room.schema.json",
  "schemaVersion": 1,
  "id": "buffer_2",
  "name": "Stray Byte",
  "biome": "outer_buffer",
  "size": [8, 4, 8],
  "spawn": [6.5, 0, 3.5],
  "exits": [{ "id": "east", "side": "+x", "at": 3, "width": 1 }],
  "blocks": [
    { "at": [0, 0, 1], "to": [1, 0, 4] },
    { "type": "stair_nx", "at": [2, 0, 2] },
    { "type": "cage", "at": [0, 0, 7] }
  ],
  "holes": [{ "at": [4, 0], "to": [4, 7] }],
  "objects": [
    { "id": "crate_1", "type": "crate", "at": [0, 1, 4] },
    { "id": "crate_2", "type": "crate", "at": [5, 0, 2] },
    { "id": "crate_3", "type": "crate", "at": [5, 0, 5] },
    { "id": "plate_1", "type": "plate_heavy", "at": [0, 0, 5] }
  ],
  "pickups": [{ "id": "secret_1", "type": "secret_1", "at": [0, 0, 7] }]
}
