{
  "$schema": "../../schemas/room.schema.json",
  "schemaVersion": 1,
  "id": "vault",
  "name": "Vault",
  "biome": "firewall_citadel",
  "size": [8, 4, 8],
  "spawn": [3.5, 0, 1.5],
  "exits": [{ "id": "north", "side": "-z", "at": 3 }],
  "blocks": [
    { "at": [1, 0, 5], "to": [2, 0, 6] },
    { "at": [5, 0, 5], "to": [6, 0, 6] }
  ],
  "pickups": [
    { "id": "fragment_a", "type": "fragment_1", "at": [1, 1, 5] },
    { "id": "fragment_b", "type": "fragment_2", "at": [6, 1, 6] },
    { "id": "integrity", "type": "refill_integrity", "at": [3, 0, 6] }
  ]
}
