{
  "$schema": "../../schemas/room.schema.json",
  "schemaVersion": 1,
  "id": "buffer_1",
  "name": "Dead Pixel",
  "biome": "outer_buffer",
  "size": [8, 4, 6],
  "spawn": [0.5, 0, 5.5],
  "exits": [{ "id": "south", "side": "+z", "at": 0, "width": 1 }],
  "blocks": [
    { "at": [0, 0, 0], "to": [3, 1, 0] },
    { "at": [6, 0, 0], "to": [7, 1, 0] },
    { "at": [0, 0, 1], "to": [1, 1, 1] },
    { "at": [0, 0, 2], "to": [0, 1, 2] },
    { "type": "fence", "at": [5, 0, 2], "to": [5, 1, 2] },
    { "type": "fence", "at": [2, 0, 3], "to": [2, 1, 3] },
    { "type": "fence", "at": [5, 0, 4], "to": [7, 1, 4] },
    { "type": "fence", "at": [3, 0, 5], "to": [7, 1, 5] },
    { "type": "fence", "at": [7, 0, 1], "to": [7, 1, 1] },
    { "type": "fence", "at": [7, 0, 3], "to": [7, 1, 3] },
    { "type": "cage", "at": [7, 0, 2], "to": [7, 1, 2] },
    { "type": "fence", "at": [0, 2, 0], "to": [7, 2, 5] }
  ],
  "objects": [
    { "id": "crate_spiked_1", "type": "crate_spiked", "at": [3, 0, 1] },
    { "id": "crate_spiked_2", "type": "crate_spiked", "at": [2, 0, 2] },
    { "id": "crate_spiked_3", "type": "crate_spiked", "at": [3, 0, 3] },
    { "id": "crate_spiked_4", "type": "crate_spiked", "at": [4, 0, 3] },
    { "id": "socket_1", "type": "socket", "at": [1, 0, 4] },
    { "id": "socket_2", "type": "socket", "at": [2, 0, 4] },
    { "id": "socket_3", "type": "socket", "at": [1, 0, 5] },
    { "id": "socket_4", "type": "socket", "at": [2, 0, 5] }
  ],
  "pickups": [{ "id": "secret_0", "type": "secret_0", "at": [7, 0, 2] }]
}
