{
  "$schema": "../../schemas/room.schema.json",
  "schemaVersion": 1,
  "id": "volatile_memory",
  "name": "Volatile Memory",
  "biome": "home_lattice",
  "size": [12, 5, 12],
  "spawn": [1.5, 0, 2],
  "exits": [
    { "id": "west", "side": "-x", "at": 1 },
    { "id": "east", "side": "+x", "at": 0, "y": 3 }
  ],
  "blocks": [
    { "at": [1, 0, 8], "to": [2, 0, 8] },
    { "at": [10, 0, 3] },
    { "at": [10, 0, 0], "to": [11, 2, 2] },
    { "type": "collapsing_regrow", "at": [3, 0, 2], "to": [6, 0, 2] },
    { "type": "collapsing", "at": [3, 0, 8], "to": [6, 0, 8] },
    { "type": "collapsing", "at": [10, 0, 4] },
    { "type": "collapsing", "at": [10, 1, 3] }
  ],
  "holes": [{ "at": [3, 0], "to": [6, 11] }],
  "objects": [{ "id": "island", "type": "crate", "at": [2, 1, 8] }]
}
