{
  "$schema": "../../schemas/room.schema.json",
  "schemaVersion": 1,
  "id": "cold_stairs",
  "name": "Cold Stairs",
  "biome": "home_lattice",
  "size": [10, 5, 12],
  "spawn": [8.5, 0, 1.5],
  "exits": [
    { "id": "north", "side": "-z", "at": 7 },
    { "id": "south", "side": "+z", "at": 5 },
    { "id": "east", "side": "+x", "at": 8 }
  ],
  "blocks": [
    { "at": [0, 0, 0], "to": [1, 2, 6] },
    { "at": [0, 0, 7], "to": [1, 1, 11] },
    { "type": "fence", "at": [2, 2, 0] },
    { "type": "fence", "at": [2, 2, 3] },
    { "type": "fence", "at": [2, 0, 1], "to": [3, 2, 2] },
    { "type": "stream", "at": [3, 0, 0], "to": [3, 1, 0] },
    { "type": "stream", "at": [3, 0, 3], "to": [3, 1, 3] },
    { "type": "bridge", "at": [6, 0, 4], "to": [7, 0, 6] }
  ],
  "holes": [{ "at": [2, 4], "to": [9, 6] }],
  "objects": [
    { "id": "screen_stairs", "type": "screen", "at": [9, 0, 3], "text": "tut_stairs", "overrides": { "face": "+x" } },
    { "id": "plate_a", "type": "plate", "at": [2, 0, 0] },
    { "id": "plate_b", "type": "plate", "at": [2, 0, 3] },
    { "id": "pad_pillar", "type": "pad", "at": [2, 0, 10] }
  ],
  "enemies": [
    { "id": "bug_a", "template": "bug", "at": [4, 0, 0], "path": { "points": [[4, 0, 1]] } },
    { "id": "bug_b", "template": "bug", "at": [4, 0, 3], "path": { "points": [[4, 0, 2]] } }
  ],
  "pickups": [
    { "id": "fragment_6", "type": "fragment_6", "at": [0, 2, 10] },
    { "id": "refill_stairs", "type": "refill_energy", "at": [9, 0, 11] }
  ]
}
