{
  "$schema": "../../schemas/room.schema.json",
  "schemaVersion": 1,
  "id": "decoy_vault",
  "name": "Decoy Vault",
  "biome": "home_lattice",
  "size": [12, 3, 8],
  "spawn": [6.5, 0, 6.5],
  "exits": [{ "id": "south", "side": "+z", "at": 7 }],
  "pickups": [{ "id": "energy", "type": "refill_energy", "at": [6, 0, 2] }]
}
