{
  "$schema": "../../schemas/room.schema.json",
  "schemaVersion": 1,
  "id": "menagerie",
  "name": "Menagerie",
  "biome": "home_lattice",
  "size": [12, 4, 12],
  "spawn": [3, 0, 10.5],
  "exits": [{ "id": "south", "side": "+z", "at": 2 }],
  "enemies": [
    { "id": "warden", "template": "warden", "at": [9, 0, 2] },
    { "id": "daemon", "template": "daemon", "at": [2, 0, 2] },
    { "id": "golem", "template": "golem", "at": [5, 0, 5], "path": { "points": [[9, 0, 5]], "pause": 0.8 } },
    { "id": "wyrm", "template": "wyrm", "at": [10, 0, 7], "path": { "points": [[10, 0, 11]], "pause": 0.5 } },
    { "id": "phish", "template": "phish", "at": [6, 0, 1] },
    { "id": "overclock", "template": "overclock", "at": [2, 0, 7] },
    { "id": "pixie", "template": "pixie", "at": [7, 0, 9], "path": { "points": [[5, 0, 9]], "pause": 0.6 } }
  ],
  "pickups": [{ "id": "integrity", "type": "refill_integrity", "at": [0, 0, 11] }]
}
